{
  "schema_version": 1,
  "candidate": {
    "repository": "EffortlessMetrics/faultline-rs",
    "pull_request": 123,
    "head_sha": "aaaaaaaaaaaaaaaaaaaaaaaaaaaaaaaaaaaaaaaa",
    "tree_sha": "bbbbbbbbbbbbbbbbbbbbbbbbbbbbbbbbbbbbbbbb"
  },
  "producer": {
    "harness": "codex-cloud",
    "model": "gpt-5.6-pro",
    "workflow_version": "sdlc-v1"
  },
  "tested_snapshot": {
    "kind": "git_tree",
    "identifier": "bbbbbbbbbbbbbbbbbbbbbbbbbbbbbbbbbbbbbbbb",
    "reconciliation": "matched"
  },
  "executions": [
    {
      "id": "focused-tests",
      "command": ["cargo", "test", "-p", "faultline-git"],
      "status": "passed",
      "exit_code": 0,
      "duration_ms": 1250,
      "required": true,
      "establishes": ["focused regression behavior"],
      "evidence_urls": ["https://example.invalid/focused-tests"]
    }
  ],
  "reviews": [
    {
      "id": "correctness-review-1",
      "kind": "correctness",
      "reviewer": "review-tower",
      "candidate_sha": "aaaaaaaaaaaaaaaaaaaaaaaaaaaaaaaaaaaaaaaa",
      "result": "approved",
      "independent": true,
      "evidence_url": "https://example.invalid/review"
    }
  ],
  "limitations": ["Does not qualify unrelated release packaging."],
  "qualification": {
    "required_execution_ids": ["focused-tests"],
    "required_review_kinds": ["correctness"],
    "blocking_limitations": []
  }
}
